{
  "$schema": "../schemas/readme-config.schema.json",
  "output": "../README.md",
  "separator": "\n\n",
  "header": {
    "comment": "This file is generated by `bun run build:readme`. Edit sources in README/ instead."
  },
  "sections": [
    { "id": "intro", "source": "human", "file": "01-intro.md" },
    {
      "id": "recipes",
      "source": "generated",
      "generator": "recipes-table",
      "options": {
        "cookbooksDir": "../cookbooks",
        "columns": ["order", "title", "stack", "difficulty", "readingTime"],
        "heading": "## Recipes"
      }
    },
    { "id": "stack", "source": "human", "file": "05-stack.md" },
    { "id": "getting-started", "source": "human", "file": "03-getting-started.md" },
    { "id": "contributing", "source": "human", "file": "04-contributing.md" },
    { "id": "license-credits", "source": "human", "file": "99-license-credits.md" }
  ]
}
